{
  "$schema": "http://json-schema.org/draft-07/schema#",
  "title": "BeautyRanking",
  "type": "object",
  "additionalProperties": false,
  "required": [
    "platform",
    "date",
    "captured_at",
    "category",
    "sample",
    "needs_review",
    "partial",
    "source_name",
    "source_url",
    "source_note",
    "items"
  ],
  "properties": {
    "platform": { "type": "string", "pattern": "^[a-z0-9]+(?:-[a-z0-9]+)*$" },
    "date": { "type": "string", "pattern": "^\\d{4}-\\d{2}-\\d{2}$" },
    "captured_at": {
      "type": "string",
      "pattern": "^\\d{4}-\\d{2}-\\d{2}T\\d{2}:\\d{2}(?::\\d{2})?(?:Z|[+-]\\d{2}:\\d{2})$"
    },
    "category": { "const": "beauty-personal-care" },
    "sample": { "type": "boolean" },
    "needs_review": { "type": "boolean" },
    "partial": { "type": "boolean" },
    "coverage_note": { "type": "string", "minLength": 4 },
    "source_name": { "type": "string", "minLength": 2, "maxLength": 60 },
    "source_url": { "type": "string", "pattern": "^https?://\\S+$" },
    "source_note": { "type": "string", "minLength": 4 },
    "items": {
      "type": "array",
      "minItems": 1,
      "maxItems": 50,
      "items": {
        "type": "object",
        "additionalProperties": false,
        "required": ["rank", "title", "brand", "needs_review"],
        "properties": {
          "rank": { "type": "integer", "minimum": 1 },
          "title": { "type": "string", "minLength": 1 },
          "title_zh": { "type": "string", "minLength": 1, "maxLength": 120 },
          "brand": { "type": "string", "minLength": 1 },
          "image_url": { "type": "string", "pattern": "^https://\\S+$" },
          "image_zoom_url": { "type": "string", "pattern": "^https://\\S+$" },
          "image": { "type": "string", "pattern": "^/media/\\S+\\.(?:webp|png|jpe?g|avif|gif)$" },
          "sales_text": { "type": "string", "minLength": 1, "maxLength": 40 },
          "bought_text": { "type": "string", "minLength": 1, "maxLength": 60 },
          "rating": { "type": "number", "minimum": 0, "maximum": 5 },
          "reviews_count": {
            "oneOf": [
              { "type": "integer", "minimum": 0 },
              { "type": "string", "minLength": 1, "maxLength": 20 }
            ]
          },
          "price": { "type": ["string", "number", "null"] },
          "currency": { "type": "string", "pattern": "^[A-Z]{3}$" },
          "url": { "type": "string", "pattern": "^(https?://\\S+)?$" },
          "note": { "type": "string" },
          "needs_review": { "type": "boolean" }
        },
        "allOf": [
          {
            "if": {
              "properties": { "needs_review": { "const": false } },
              "required": ["needs_review"]
            },
            "then": {
              "required": ["url"],
              "properties": {
                "url": { "type": "string", "pattern": "^https?://\\S+$" }
              }
            }
          }
        ]
      }
    }
  },
  "allOf": [
    {
      "if": { "properties": { "partial": { "const": true } }, "required": ["partial"] },
      "then": { "required": ["coverage_note"] }
    }
  ]
}
