{
  "platform": "amazon-sg",
  "date": "2026-10-23",
  "captured_at": "2026-10-23T10:35:00+08:00",
  "category": "beauty-personal-care",
  "sample": false,
  "needs_review": true,
  "partial": true,
  "coverage_note": "Amazon.sg Beauty Best Sellers Top15（页面 Top30 中前15）。价格 SGD。无公开「bought in past month」文案故省略 sales_text。ASIN/主图未解析→needs_review。",
  "source_name": "Amazon.sg Best Sellers · Beauty",
  "source_url": "https://www.amazon.sg/gp/bestsellers/beauty",
  "source_note": "WebFetch 榜单页 2026-10-23。类目含剃须/美发工具，与美妆日化有重叠。",
  "items": [
    {
      "rank": 1,
      "title": "Wet Brush Original Detangler Hair Brush, Color Wash, Watermark, Ultra-Soft IntelliFlex Bristles - Detangling Hairbrush Glides Through Tangles For Wet, Dry & Damaged Hair, Women & Men",
      "title_zh": "湿发梳 Wet Brush Original Detangler 解结梳｜IntelliFlex 刷毛，干湿两用",
      "brand": "Wet Brush",
      "price": 7.54,
      "currency": "SGD",
      "url": "https://www.amazon.sg/s?k=Wet+Brush+Original+Detangler+Hair+Brush,+Color+Wash,+Watermark,+Ultra-Soft+Intel",
      "rating": 4.7,
      "needs_review": true,
      "note": "榜页未稳定解析出 ASIN/主图；url 暂用搜索链接，合入前需补商品页与 image_url",
      "reviews_count": 3059
    },
    {
      "rank": 2,
      "title": "CeraVe Moisturizing Cream for Normal to Dry Skin | 19 Ounce | Fragrance Free | Packaging May Vary",
      "title_zh": "适乐肤（CeraVe）保湿霜，19 oz｜无香，适中干性肌",
      "brand": "CeraVe",
      "price": 29.59,
      "currency": "SGD",
      "url": "https://www.amazon.sg/s?k=CeraVe+Moisturizing+Cream+for+Normal+to+Dry+Skin+|+19+Ounce+|+Fragrance+Free+|+P",
      "rating": 4.7,
      "needs_review": true,
      "note": "榜页未稳定解析出 ASIN/主图；url 暂用搜索链接，合入前需补商品页与 image_url",
      "reviews_count": 137214
    },
    {
      "rank": 3,
      "title": "eos Shea Better Body Lotion- Vanilla Cashmere, 24-Hour Moisture, 16 fl oz | Natural Shea Butter & Oil, Whipped Vanilla & Caramel, Lasting Hydration, 100% Vegan & Cruelty-Free, Apply to Dry Skin",
      "title_zh": "eos Shea Better 身体乳-香草羊绒，24小时保湿，16 fl oz",
      "brand": "eos",
      "price": 18.68,
      "currency": "SGD",
      "url": "https://www.amazon.sg/s?k=eos+Shea+Better+Body+Lotion-+Vanilla+Cashmere,+24-Hour+Moisture,+16+fl+oz+|+Natu",
      "rating": 4.7,
      "needs_review": true,
      "note": "榜页未稳定解析出 ASIN/主图；url 暂用搜索链接，合入前需补商品页与 image_url",
      "reviews_count": 64918
    },
    {
      "rank": 4,
      "title": "CeraVe Eye Repair Cream for Dark Circles Under Eyes and Puffiness, 0.5 oz | Skin Care, Under Eye Treatment for Puffiness with Niacinamide, Ceramides & Marine Botanical Complex, Ophthalmologist Tested",
      "title_zh": "适乐肤眼霜，0.5 oz｜烟酰胺+神经酰胺，淡化黑眼圈浮肿",
      "brand": "CeraVe",
      "price": 23.09,
      "currency": "SGD",
      "url": "https://www.amazon.sg/s?k=CeraVe+Eye+Repair+Cream+for+Dark+Circles+Under+Eyes+and+Puffiness,+0.5+oz+|+Skin",
      "rating": 4.3,
      "needs_review": true,
      "note": "榜页未稳定解析出 ASIN/主图；url 暂用搜索链接，合入前需补商品页与 image_url",
      "reviews_count": 72920
    },
    {
      "rank": 5,
      "title": "CETAPHIL Redness Relieving Foaming Face Wash for Sensitive Skin , 8 fl oz , Gently Cleanses & Calms Sensitive Skin Without Over Drying, (Packaging May Vary)",
      "title_zh": "丝塔芙（Cetaphil）舒缓泛红泡沫洁面，8 fl oz｜敏感肌",
      "brand": "Cetaphil",
      "price": 19.52,
      "currency": "SGD",
      "url": "https://www.amazon.sg/s?k=CETAPHIL+Redness+Relieving+Foaming+Face+Wash+for+Sensitive+Skin+,+8+fl+oz+,+Gent",
      "rating": 4.4,
      "needs_review": true,
      "note": "榜页未稳定解析出 ASIN/主图；url 暂用搜索链接，合入前需补商品页与 image_url",
      "reviews_count": 10761
    },
    {
      "rank": 6,
      "title": "Burt's Bees 100% Natural Moisturizing Lip Balm, Multipack - Original Beeswax, Strawberry, Coconut & Pear and Vanilla Bean with Beeswax & Fruit Extracts - 4 Tubes",
      "title_zh": "伯特小蜜蜂（Burt's Bees）润唇膏四支装｜原味/草莓/椰子梨/香草",
      "brand": "Burt's Bees",
      "price": 13.4,
      "currency": "SGD",
      "url": "https://www.amazon.sg/s?k=Burt's+Bees+100%+Natural+Moisturizing+Lip+Balm,+Multipack+-+Original+Beeswax,+St",
      "rating": 4.8,
      "needs_review": true,
      "note": "榜页未稳定解析出 ASIN/主图；url 暂用搜索链接，合入前需补商品页与 image_url",
      "reviews_count": 113699
    },
    {
      "rank": 7,
      "title": "Philips Norelco Quick Clean Pod Cartridge, Lubricates Shaver and Eliminates Cut Hair, 2x 5.4 fl oz Cartridges (Up to 6m Supply), CC12/52",
      "title_zh": "飞利浦 Norelco 剃须刀 Quick Clean 清洁舱补充装，2×5.4 fl oz",
      "brand": "Philips Norelco",
      "price": 11.63,
      "currency": "SGD",
      "url": "https://www.amazon.sg/s?k=Philips+Norelco+Quick+Clean+Pod+Cartridge,+Lubricates+Shaver+and+Eliminates+Cut+",
      "rating": 4.7,
      "needs_review": true,
      "note": "榜页未稳定解析出 ASIN/主图；url 暂用搜索链接，合入前需补商品页与 image_url",
      "reviews_count": 3714
    },
    {
      "rank": 8,
      "title": "Schick Quattro Titanium Razor, 1 Razor Handle and 4 Cartridges | Shaving Razors for Men, 4 Blade Mens Razors for Shaving, Razor Blades for Men, 1 Handle with 4 Razor Blades Refills",
      "title_zh": "舒芙/舒适（Schick）Quattro 钛金男士剃须刀，1刀架+4刀头",
      "brand": "Schick",
      "price": 9.46,
      "currency": "SGD",
      "url": "https://www.amazon.sg/s?k=Schick+Quattro+Titanium+Razor,+1+Razor+Handle+and+4+Cartridges+|+Shaving+Razors+",
      "rating": 4.4,
      "needs_review": true,
      "note": "榜页未稳定解析出 ASIN/主图；url 暂用搜索链接，合入前需补商品页与 image_url",
      "reviews_count": 630
    },
    {
      "rank": 9,
      "title": "TONYMOLY I'm Lotus Sheet Mask - Brightening Korean Face Mask with Collagen | Lotus Flower Extract soothes and calms, while Cherry Blossom Extract brings a naturally brightening boost for a radiant glow",
      "title_zh": "托尼魅力（TONYMOLY）莲花提亮面膜｜胶原蛋白，韩国护肤",
      "brand": "TONYMOLY",
      "price": 6.45,
      "currency": "SGD",
      "url": "https://www.amazon.sg/s?k=TONYMOLY+I'm+Lotus+Sheet+Mask+-+Brightening+Korean+Face+Mask+with+Collagen+|+Lot",
      "rating": 4.6,
      "needs_review": true,
      "note": "榜页未稳定解析出 ASIN/主图；url 暂用搜索链接，合入前需补商品页与 image_url",
      "reviews_count": 173
    },
    {
      "rank": 10,
      "title": "Gold Bond Age Renew Retinol Overnight Body & Face Lotion, With Retinol & Peptide Complex, 13 oz.",
      "title_zh": "Gold Bond Age Renew 视黄醇过夜身体/面部乳，13 oz",
      "brand": "Gold Bond",
      "price": 26.12,
      "currency": "SGD",
      "url": "https://www.amazon.sg/s?k=Gold+Bond+Age+Renew+Retinol+Overnight+Body+&+Face+Lotion,+With+Retinol+&+Peptide",
      "rating": 4.5,
      "needs_review": true,
      "note": "榜页未稳定解析出 ASIN/主图；url 暂用搜索链接，合入前需补商品页与 image_url",
      "reviews_count": 6960
    },
    {
      "rank": 11,
      "title": "Philips Norelco Genuine OneBlade 360 Blade Replacement Blades, 3 Count, QP430/80",
      "title_zh": "飞利浦 OneBlade 360 替换刀头，3片装",
      "brand": "Philips Norelco",
      "price": 42.07,
      "currency": "SGD",
      "url": "https://www.amazon.sg/s?k=Philips+Norelco+Genuine+OneBlade+360+Blade+Replacement+Blades,+3+Count,+QP430/80",
      "rating": 4.7,
      "needs_review": true,
      "note": "榜页未稳定解析出 ASIN/主图；url 暂用搜索链接，合入前需补商品页与 image_url",
      "reviews_count": 5527
    },
    {
      "rank": 12,
      "title": "RAW Batana Oil for Hair Growth, Dr Sebi Organic Unrefined Batana Oil from Honduran, 100% Pure & Natural Hair Growth Oil for Thicker & Stronger Hair - 2 FL OZ - 60Ml - 1Pack",
      "title_zh": "RAW 巴塔纳护发油，2 fl oz｜未精制，助发丝浓密",
      "brand": "RAW",
      "price": 15.66,
      "currency": "SGD",
      "url": "https://www.amazon.sg/s?k=RAW+Batana+Oil+for+Hair+Growth,+Dr+Sebi+Organic+Unrefined+Batana+Oil+from+Hondur",
      "rating": 4.2,
      "needs_review": true,
      "note": "榜页未稳定解析出 ASIN/主图；url 暂用搜索链接，合入前需补商品页与 image_url",
      "reviews_count": 542
    },
    {
      "rank": 13,
      "title": "Cerave Cerave Resurfacing Retinol Serum For Post Acne Marks 30ml | Skin Care Brightening Serum with Licorice Root, Acne Scar & Hyperpigmentation Treatment, Dark Spot Corrector, Skin Repair",
      "title_zh": "适乐肤视黄醇精华 30ml｜淡化痘印色沉",
      "brand": "CeraVe",
      "price": 24.9,
      "currency": "SGD",
      "url": "https://www.amazon.sg/s?k=Cerave+Cerave+Resurfacing+Retinol+Serum+For+Post+Acne+Marks+30ml+|+Skin+Care+Bri",
      "rating": 4.6,
      "needs_review": true,
      "note": "榜页未稳定解析出 ASIN/主图；url 暂用搜索链接，合入前需补商品页与 image_url",
      "reviews_count": 55597
    },
    {
      "rank": 14,
      "title": "Kirei Kirei Medicated Foaming Hand Soap, 4 L, Fruit Mix Scent Refill, Commercial Use, Large Quantity",
      "title_zh": "洁丽丽（Kirei Kirei）药用泡沫洗手液补充装，4L｜果香",
      "brand": "Kirei Kirei",
      "price": 34.02,
      "currency": "SGD",
      "url": "https://www.amazon.sg/s?k=Kirei+Kirei+Medicated+Foaming+Hand+Soap,+4+L,+Fruit+Mix+Scent+Refill,+Commercial",
      "rating": 4.5,
      "needs_review": true,
      "note": "榜页未稳定解析出 ASIN/主图；url 暂用搜索链接，合入前需补商品页与 image_url",
      "reviews_count": 787
    },
    {
      "rank": 15,
      "title": "L'Oreal Paris Le Color One Step Toning Hair Gloss, Cool Brunette, 4 Ounce",
      "title_zh": "欧莱雅巴黎 Le Color 一步调色发油，冷棕，4 oz",
      "brand": "L'Oreal Paris",
      "price": 25.21,
      "currency": "SGD",
      "url": "https://www.amazon.sg/s?k=L'Oreal+Paris+Le+Color+One+Step+Toning+Hair+Gloss,+Cool+Brunette,+4+Ounce",
      "rating": 4.2,
      "needs_review": true,
      "note": "榜页未稳定解析出 ASIN/主图；url 暂用搜索链接，合入前需补商品页与 image_url",
      "reviews_count": 1378
    }
  ]
}
